[
  {
    "npc_id": "npc_marrow_vell_quartermaster_v0",
    "display_name": "Marrow Vell",
    "role": "Quartermaster",
    "location_id": "hub_quartermaster_corner",
    "quest_ids": [
      "quest_still_water",
      "quest_floor_gives_way",
      "quest_back_to_one",
      "quest_pry_rights",
      "quest_ticket_hunger"
    ],
    "description": "V0.1 quartermaster with a dry, practical tone who frames the first survival objectives."
  }
]
